{
  "schema_version": "1.0",
  "report_id": "rpt-20240315-001",
  "status": "ERROR",
  "summary": {
    "finding_count": 94,
    "status_counts": {
      "ERROR": 1,
      "NOT_SUPPORTED": 2,
      "WARNING": 15,
      "PASS": 76
    },
    "not_supported_rule_ids": ["FORMULA-001", "READY-001"],
    "blocking_rule_ids": ["FRM-002"]
  },
  "findings": [
    {
      "rule_id": "FRM-002",
      "status": "ERROR",
      "severity": "BLOCKER",
      "confidence": "HIGH",
      "evidence": "DETERMINISTIC_FINDING",
      "location": { "sheet": "MM_Change_Log", "cell": "L7" },
      "observed": { "functions": ["AGGREGATE", "FILTER"], "first_site": "MM_Change_Log!L7", "occurrences": 8 },
      "expected": { "note": "Only functions on the MMForExcel supported list may be used." },
      "message": "Formula uses AGGREGATE and FILTER which are not on the MM supported function list. These must be replaced before the workbook can be loaded into Mind.",
      "readiness_impact": "ERROR",
      "correction_available": true,
      "source": { "document": "MM-KB-FRM-002", "article": "Supported Functions" }
    },
    {
      "rule_id": "FORMULA-001",
      "status": "NOT_SUPPORTED",
      "severity": "HIGH",
      "confidence": "HIGH",
      "evidence": "DOCUMENTED_RULE",
      "location": { "sheet": "Cashflows", "cell": "D5" },
      "observed": { "reference_type": "whole_column", "count": 71 },
      "expected": { "note": "Mind does not support whole-column references." },
      "message": "71 whole-column references detected starting at Cashflows!D5. Mind cannot resolve whole-column references and will fail to load the workbook.",
      "readiness_impact": "NOT_SUPPORTED",
      "correction_available": false,
      "source": { "document": "MM-KB-FORMULA-001", "article": "Cell Reference Restrictions" }
    },
    {
      "rule_id": "READY-001",
      "status": "NOT_SUPPORTED",
      "severity": "HIGH",
      "confidence": "HIGH",
      "evidence": "DOCUMENTED_RULE",
      "location": { "sheet": "Lookup" },
      "observed": { "protection": true, "sheet": "Lookup" },
      "expected": { "note": "Protected sheets cannot be processed by Mind." },
      "message": "Sheet 'Lookup' is protected. Mind cannot read protected sheets.",
      "readiness_impact": "NOT_SUPPORTED",
      "correction_available": true,
      "source": { "document": "MM-KB-READY-001", "article": "Sheet Protection" }
    },
    {
      "rule_id": "DBG-003",
      "status": "WARNING",
      "severity": "MEDIUM",
      "confidence": "HIGH",
      "evidence": "DETERMINISTIC_FINDING",
      "location": { "sheet": "Cashflows", "cell": "D5" },
      "observed": { "count": 71, "example": "D:D" },
      "message": "71 whole-column references found in Cashflows. These may cause performance issues and are not supported in some Mind configurations.",
      "readiness_impact": "WARNING",
      "correction_available": false,
      "source": { "document": "MM-KB-DBG-003" }
    },
    {
      "rule_id": "STR-004",
      "status": "WARNING",
      "severity": "MEDIUM",
      "confidence": "HIGH",
      "evidence": "DETERMINISTIC_FINDING",
      "location": { "sheet": "Data" },
      "observed": { "untitled_count": 136, "sheets_affected": ["Data", "Assumptions", "Cashflows"] },
      "message": "136 grids have no #Title cell. Mind requires all grids to be titled for correct identification.",
      "readiness_impact": "WARNING",
      "correction_available": true,
      "source": { "document": "MM-KB-STR-004" }
    },
    {
      "rule_id": "FMT-002",
      "status": "WARNING",
      "severity": "LOW",
      "confidence": "HIGH",
      "evidence": "DETERMINISTIC_FINDING",
      "location": {},
      "observed": { "theme_colour_cells": 284, "sheets_affected": 7 },
      "message": "284 cells use theme colours. Mind resolves theme colours differently across environments; replace with explicit RGB values.",
      "readiness_impact": "WARNING",
      "correction_available": true,
      "source": { "document": "MM-KB-FMT-002" }
    },
    {
      "rule_id": "STR-001",
      "status": "WARNING",
      "severity": "LOW",
      "confidence": "HIGH",
      "evidence": "DETERMINISTIC_FINDING",
      "location": { "sheet": "Hidden_Params" },
      "observed": { "sheet_name": "Hidden_Params", "hidden": true, "has_hide_flag": false },
      "message": "Sheet 'Hidden_Params' is hidden but its name does not end with &&Hide. Mind uses the &&Hide suffix to identify sheets that should remain hidden.",
      "readiness_impact": "WARNING",
      "correction_available": true,
      "source": { "document": "MM-KB-STR-001" }
    },
    {
      "rule_id": "STR-001",
      "status": "WARNING",
      "severity": "LOW",
      "confidence": "HIGH",
      "evidence": "DETERMINISTIC_FINDING",
      "location": { "sheet": "VeryHiddenCalc" },
      "observed": { "sheet_name": "VeryHiddenCalc", "hidden": true, "has_hide_flag": false },
      "message": "Sheet 'VeryHiddenCalc' is very hidden but its name does not end with &&Hide.",
      "readiness_impact": "WARNING",
      "correction_available": true,
      "source": { "document": "MM-KB-STR-001" }
    },
    {
      "rule_id": "LOOP-002",
      "status": "WARNING",
      "severity": "MEDIUM",
      "confidence": "MEDIUM",
      "evidence": "INFERENCE",
      "location": { "sheet": "CSM", "cell": "B2" },
      "observed": { "loop_name": "Cohort_loop", "expected_case": "CohortLoop" },
      "message": "Loop name 'Cohort_loop' uses inconsistent capitalisation. Mind is case-sensitive; normalise to PascalCase.",
      "readiness_impact": "WARNING",
      "correction_available": true,
      "source": { "document": "MM-KB-LOOP-002" }
    },
    {
      "rule_id": "FMT-005",
      "status": "WARNING",
      "severity": "LOW",
      "confidence": "MEDIUM",
      "evidence": "INFERENCE",
      "location": { "sheet": "Top", "cell": "B5" },
      "observed": { "title_cell": "B5", "row_above": "B4", "row_above_not_empty": true },
      "message": "Grid '#Model Parameters' at Top!B5 has a non-empty cell immediately above its title. Mind requires an empty row before each #Title.",
      "readiness_impact": "WARNING",
      "correction_available": true,
      "source": { "document": "MM-KB-FMT-005" }
    },
    {
      "rule_id": "FMT-007",
      "status": "WARNING",
      "severity": "LOW",
      "confidence": "HIGH",
      "evidence": "DETERMINISTIC_FINDING",
      "location": { "sheet": "Cashflows" },
      "observed": { "grid": "Cashflow Results", "flag": "/Reorder", "missing_flag": "/Input" },
      "message": "Grid '#Cashflow Results' has /Reorder flag but is missing the required /Input flag. Mind expects both flags on reorderable grids.",
      "readiness_impact": "WARNING",
      "correction_available": true,
      "source": { "document": "MM-KB-FMT-007" }
    },
    {
      "rule_id": "ITER-001",
      "status": "WARNING",
      "severity": "MEDIUM",
      "confidence": "MEDIUM",
      "evidence": "INFERENCE",
      "location": { "sheet": "BEL", "cell": "D12" },
      "observed": { "circular_count": 3 },
      "message": "3 potential circular references detected in BEL sheet. Mind requires explicit iteration settings.",
      "readiness_impact": "WARNING",
      "correction_available": false,
      "source": { "document": "MM-KB-ITER-001" }
    },
    {
      "rule_id": "PERF-001",
      "status": "WARNING",
      "severity": "LOW",
      "confidence": "LOW",
      "evidence": "RECOMMENDATION",
      "location": { "sheet": "Cashflows" },
      "observed": { "array_formula_count": 38 },
      "message": "38 array formulas in Cashflows may slow Mind recalculation. Consider converting to dynamic array formulas where possible.",
      "readiness_impact": "WARNING",
      "correction_available": false,
      "source": { "document": "MM-KB-PERF-001" }
    },
    {
      "rule_id": "FMT-003",
      "status": "WARNING",
      "severity": "LOW",
      "confidence": "HIGH",
      "evidence": "DETERMINISTIC_FINDING",
      "location": { "sheet": "Lookup" },
      "observed": { "header": "Male qx", "expected_format": "text only" },
      "message": "Grid '#Mortality Table' has a mixed header row. Mind requires all header cells to be plain text with no formulas.",
      "readiness_impact": "WARNING",
      "correction_available": true,
      "source": { "document": "MM-KB-FMT-003" }
    },
    {
      "rule_id": "STR-007",
      "status": "WARNING",
      "severity": "LOW",
      "confidence": "MEDIUM",
      "evidence": "INFERENCE",
      "location": { "sheet": "MM_Change_Log" },
      "observed": { "apostrophe_cells": 12 },
      "message": "12 cells use apostrophe-space prefix to force text formatting. This can cause unexpected behaviour in Mind.",
      "readiness_impact": "WARNING",
      "correction_available": true,
      "source": { "document": "MM-KB-STR-007" }
    },
    {
      "rule_id": "FLAG-001",
      "status": "WARNING",
      "severity": "MEDIUM",
      "confidence": "HIGH",
      "evidence": "DETERMINISTIC_FINDING",
      "location": { "sheet": "BEL", "cell": "B4" },
      "observed": { "flag": "/Inout", "corrected": "/Input" },
      "message": "Grid '#Best Estimate Liability' has a misspelt flag '/Inout'. Correct to '/Input'.",
      "readiness_impact": "WARNING",
      "correction_available": true,
      "source": { "document": "MM-KB-FLAG-001" }
    },
    {
      "rule_id": "RES-002",
      "status": "PASS",
      "severity": "INFO",
      "confidence": "HIGH",
      "evidence": "DOCUMENTED_RULE",
      "location": {},
      "message": "No external links detected. Workbook is self-contained.",
      "readiness_impact": "PASS",
      "correction_available": false,
      "source": { "document": "MM-KB-RES-002" }
    },
    {
      "rule_id": "RES-003",
      "status": "PASS",
      "severity": "INFO",
      "confidence": "HIGH",
      "evidence": "DOCUMENTED_RULE",
      "location": {},